MA - 000138,Customer Voice TA Facility,a27eq000001lhdd,,,,Kenya,ODP,,0,0,0,0,0,,2024,,Report for Apollo Agriculture (9000104719),4/12/2024,,Stakeholder Survey,9000116069,,,0,0,,,,,,Office of Investment Policy,12/16/2024,,Technical Assistance,,1000000,1000000,1,1,5/15/2023,,Disbursing (after 1st Disbursement),100,Q3-2023,2023,195,655,Portfolio,"The TA will establish the DFC Customer Voice TA Facility to support the design, implementation, and analysis of end-customer surveys.",0,0,11/1/2022,11/12/2024,,0063d0000029xMF,Office of Investment Policy,Technical Assistance Specialist,,Office of Development Policy (ODP),,Technical Assistance,0,,Not Created,,,,,,,0,,,,,,,,,0,,,,,,,,,,,,,,,,,,,,0,Not Scored,0.1.4,,JXCNK5CC1LP8,0,0,,0,,1,,,,,9000116069,0,0,,,,,,0,,,,,,10/21/2022,,,,,,5/19/2023,Sub-IC,0,,,Worldwide,"Worldwide, Kenya",ALL,0,0,0,1,,,999,,,N/A,0,0,,0,0,"60 Decibels, Inc.",,,,0013d000009fMrW,,,United States,,A-036684
MA - 000134,"Root Capital, Inc.",a27eq000001aTMH,,,,Kenya,ODP,,0,0,0,0,0,,2024,,,10/28/2024,,Environmental & Social Compliance Project Evaluation,9000115654,,,0,0,,,,,,,11/27/2024,,SMEF,,35000000,35000000,1,1,9/30/2022,,Transferred to Monitoring,100,Q4-2022,2022,315,663,Portfolio,Partial Guaranty for loans to SMEs in the agricultural sector including newly launched climate adaptation and mitigation loans,0,0,11/19/2021,4/7/2025,,006t0000004FNjN,,Portfolio Monitoring Specialist,,Office of Financial And Portfolio Management (OFPM),,OPIC Portfolio Monitoring,1,,Policy Clearance Completed,a38b9f6c-ff21-41a0-a3fa-4b71f59bd028,49570,,,,SOC-3163,0,3/29/2022,C-Cleared,Clearance Completed,,,,,EN-03164,0,C,3/29/2022,C-Cleared,2022-03-29,Clearance Completed,a21t000000EtANB,9000115654-IQ Adjustment Initial Score 2022,,,,,EC-05929,a1It000000B6MGH,Clearance Completed,2022-04-27,4/27/2022,C-Cleared,,134,133.99,Highly Developmental,0.1.4,,Y55MT7JXCHL3,0,0,3/27/2023,0,,1,,,,,9000115654,0,0,,4/11/2022,,,,0,5/13/2022,,,3/24/2022,,1/14/2022,,,5/13/2022,,,,IC,0,,,Worldwide,"United States, Worldwide, Kenya",ALL,0,0,0,1,,,999,,1,Lower Middle Income,1,1,"Updated reporting count and project relationship January, 2023",0,0,"Root Capital, Inc.",,SF,,001t0000001ufUT,,,United States,,A-015358
MA - 000079,Energy Access Relief Fund B.V.,a273d000002NZXs,,,,Kenya,ODP,,0,0,0,0,0,,2024,,,4/11/2024,9/16/2025,Development Impact Monitoring Review,9000104494,,,0,0,,,,,,Office of Investment Policy,8/15/2024,,SF,,10000000,10000000,1,1,8/27/2021,,Transferred to Monitoring,100,Q4-2021,2021,442,1191,Portfolio,Participate as a senior lender in the COVID-19 Energy Access Relief Fund,0,0,6/11/2020,4/16/2025,,006t0000003QL4g,,Portfolio Monitoring Specialist,,Office of Financial And Portfolio Management (OFPM),,OPIC Portfolio Monitoring,1,,Policy Clearance Completed,63c6c967-4858-40d5-810b-c21bb47aa448,38714,,,,SOC-2861,0,11/5/2020,C-Cleared,Clearance Completed,,,,,EN-02861,0,C,11/5/2020,C-Cleared,2020-11-05,Clearance Completed,a21t000000Et6iK,9000104494-IQ Adjustment Initial Score 2021,,,,,EC-05619,a1It000000Asr5n,Clearance Completed,2021-02-18,2/18/2021,C-Cleared,,118.9,118.92,Highly Developmental,0.1.4,,,0,0,1/24/2022,0,,1,,,,,9000104494,0,0,,,,,,0,,,,5/21/2021,,5/15/2020,,,5/21/2021,,,,Sub-IC,0,,,Worldwide,"Worldwide, Kenya",ALL,0,0,0,1,,,999,,1,Lower Middle Income,1,1,,0,0,"Social Investment Managers & Advisors, LLC (SIMA)",,SF,,001t000000C5Ty4,,,United States,,A-033333
MA - 000076,Lendable Inc.,a273d000002NYXt,,,,Kenya,ODP,,0,0,0,0,0,,2024,,,4/17/2024,6/30/2027,Development Impact Monitoring Review,9000104276,,,0,0,,,,,,Office of Investment Policy,8/15/2024,,SMEF,,20000000,20000000,1,1,9/3/2021,,Transferred to Monitoring,100,Q4-2021,2021,549,1153,Portfolio,Lendable MSME Fintech Credit Fund provides debt facilities to fintech companies operating in Africa and Asia that promote greater financial inclusion,0,0,3/3/2020,4/15/2025,,006t0000002Bv68,,Portfolio Monitoring Specialist,,Office of Financial And Portfolio Management (OFPM),,OPIC Portfolio Monitoring,1,,Policy Clearance Completed,1e710046-a927-4d8d-96eb-e82341be9323,35469,,,,SOC-2726,0,5/14/2020,C-Cleared,Clearance Completed,,,,,EN-02726,0,D,5/14/2020,C-Cleared,2020-05-14,Clearance Completed,a21t000000Et6rq,9000104276-IQ Adjustment Initial Score 2021,,,,,EC-05484,a1It000000B1zuu,Clearance Completed,2021-03-08,3/8/2021,C-Cleared,,130.4,132.86,Highly Developmental,0.1.4,,,0,0,3/3/2022,0,,1,,,,,9000104276,0,0,,,,,,0,,,,6/14/2021,,2/19/2020,,,6/14/2021,,,,Sub-IC,0,,,Africa Regional,"AFRICA REGIONAL, Asia Regional, Kenya",Africa,0,0,0,1,,,699,,1,Lower Middle Income,1,0,,0,0,Lendable MSME Fintech Credit Fund,,SF,,001t000000MwA3S,,,Luxembourg,,A-035062
MA - 000066,"BluePeak Private Capital Fund, SCSp",a273d000002AEK6,,,,Kenya,ODP,,0,0,0,0,0,,2024,,,5/13/2024,3/13/2044,Environmental & Social Compliance Project Evaluation,9000104708,,,0,0,,,,,,,6/26/2024,,Fund,,30000000,30000000,1,1,6/30/2021,,Disbursing (after 1st Disbursement),100,Q3-2021,2021,282,1230,Portfolio,Multi-sector credit fund investing 80% in twelve core countries in Africa and up to 20% in the rest of Africa and the Levant region.,0,0,9/21/2020,4/8/2025,,006t0000003Dt6S,,Investment Funds Specialist,,Office of Investment Funds (OIF),,Equity - Funds,1,,Policy Clearance Completed,fee26682-9d21-4b97-8391-e02406ea6aaa,43050,,,Parent-level Investment Fund (IFD),SOC-2934,0,3/5/2021,C-Cleared,Clearance Completed,,,,,EN-02935,0,D,3/5/2021,C-Cleared,2021-03-05,Clearance Completed,a21t000000Et6oS,9000104708-IQ Adjustment Initial Score 2021,,,,,EC-05692,a1It000000B1yw4,Clearance Completed,2021-03-24,3/24/2021,C-Cleared,,117,117.04,Highly Developmental,0.1.4,,,0,0,,0,,1,,,,,9000104708,0,0,,3/26/2021,,,,0,4/21/2021,4/21/2021,,,,,3/5/2021,3/5/2021,4/21/2021,,,,Board,0,,,Africa Regional,AFRICA REGIONAL,Africa,0,0,0,1,,,699,,1,Lower Middle Income,1,0,Updated May 2023,0,0,BluePeak Private Capital GP,,SF,,001t000000XcDLW,,,,,A-035619
MA - 000153,Kentegra Biotechnology Holding LLC,a27eq000002AK17,,,,Kenya,ODP,,0,0,0,0,0,,2024,,,9/18/2024,7/15/2030,Environmental & Social Compliance Project Evaluation,9000115973,,,0,0,,,,,,Office of Investment Policy,1/27/2025,,SMEF,,10000000,10000000,1,1,1/30/2023,,Transferred to Monitoring,100,Q2-2023,2023,201,104,Portfolio,This Project involves the expansion of Kentegra Biotechnologies facilities to refine pyrethrum flowers into a key ingredient in organic pesticides.,0,0,7/13/2022,4/15/2025,,006t0000004CBuk,,Portfolio Monitoring Specialist,,Office of Financial And Portfolio Management (OFPM),,OPIC Portfolio Monitoring,1,,Policy Clearance Completed,96c786f9-dc6f-4c47-a371-4331f755a0e5,53087,,,,SOC-3312,1,1/26/2023,C-Cleared,Clearance Completed,,,,,EN-03313,0,B,1/26/2023,C-Cleared,2023-01-26,Clearance Completed,a21t000000HGgjI,9000115973-IQ Adjustment Initial Score 2023,,,,,EC-06086,a1I3d000000910Z,Clearance Completed,2023-01-26,1/26/2023,C-Cleared,,118.2,118.24,Highly Impactful,0.1.4,,KGZ2SMD1QCF5,0,0,12/3/2024,0,,1,,,,,9000115973,0,0,,,,,,0,,,,12/22/2022,,7/26/2022,,,12/16/2022,,,,Sub-IC,0,Low,,Kenya,Kenya,Africa,0,0,0,1,,,615,,,Lower Middle Income,0,1,Impact assessment clearance/IQ was conduced by ECON before transition of IQ to IMML in FY23,0,0,Kentegra Holdings US Inc.,,SF,,001t0000009EELj,,,United States,,A-032079
MA - 000152,Mr Green Africa Trading Kenya Limited,a27eq000002AJWT,,,,Kenya,ODP,,0,0,0,0,0,,2024,,,9/20/2024,12/15/2028,Environmental & Social Compliance Project Evaluation,9000116233,,,0,0,,,,,,Office of Investment Policy,1/27/2025,,SMEF,,5000000,500000,1,1,8/25/2023,,Loan Disbursed,10,Q4-2023,2023,219,308,Portfolio,Loan to a plastic recycling company that sources plastic waste from the informal sector in Kenya.,0,0,1/18/2023,4/3/2025,,0063d000002BoP9,,"Managing Director, Social Enterprise Finance",,Office Of Catalytic Investments (OCI),,Equity - Funds,1,,Policy Clearance Completed,add0ea54-daa8-491d-91ad-50c44b3f41ad,55063,,,,SOC-3429,0,8/31/2023,C-Cleared,Clearance Completed,,,,,EN-03432,0,B,8/31/2023,C-Cleared,2023-08-31,Clearance Completed,a213d000001XTmD,9000116233-IQ Adjustment Initial Score 2023,,,,,EC-06299,a1I3d000000GNLu,Clearance Completed,2023-09-12,9/12/2023,C-Cleared,,,128.93,Exceptional,0.1.4,,,1,0,,0,,1,,,,,9000116233,0,0,,,,,,0,,,,8/31/2023,,3/17/2023,,,8/31/2023,,,,Sub-IC,0,Low,,Kenya,Kenya,Africa,0,0,0,1,,,615,,1,Lower Middle Income,0,0,,0,0,,,,,,,,,,
MA - 000151,Roam Electric Limited,a27eq000002AIYn,,,,Kenya,ODP,,0,0,0,0,0,,2024,,,9/14/2024,2/15/2031,Environmental & Social Compliance Project Evaluation,9000116238,,,0,0,,,,,,Office of Investment Policy,1/27/2025,,SMEF,,10000000,10000000,1,1,9/15/2023,,Transferred to Monitoring,100,Q4-2023,2023,238,104,Portfolio,A technology driven electric mobility company that designs and develops electric motorcycles and electric buses for emerging market consumers.,0,0,1/20/2023,2/27/2025,,0063d000002Bs73,VP SF,"Managing Director, Asset Management",,Office of Financial And Portfolio Management (OFPM),,OPIC Portfolio Monitoring,1,,Policy Clearance Completed,d31ced44-2022-4210-93a1-faed8d48a4f9,55529,,,,SOC-3459,0,8/30/2023,C-Cleared,Clearance Completed,,,,,EN-03462,0,B,9/5/2023,C-Cleared,2023-09-05,Clearance Completed,a213d000001fzd7,9000116238-IQ Adjustment Initial Score 2023,,,,,EC-06422,a1I3d000000FwTz,Clearance Completed,2023-09-08,9/8/2023,C-Cleared,,,140.78,Exceptional,0.1.4,,,1,0,12/11/2024,0,,1,,,,,9000116238,0,0,,,,,,0,,,,8/17/2023,,4/13/2023,,,8/17/2023,,,,Sub-IC,0,Low,,Kenya,Kenya,Africa,0,0,0,1,,,615,,1,Lower Middle Income,0,0,,0,0,,,,,,,,,,
MA - 000136,Poa Internet Kenya Limited,a27eq000001ldIH,,,,Kenya,ODP,,0,0,0,0,0,,2025,,Customer Voice survey via 60 Decibels,12/11/2024,4/15/2029,Stakeholder Survey,9000105274,,,0,0,,,,,,Office of Investment Policy,12/16/2024,,SMEF,,5000000,5000000,1,1,3/15/2022,,Transferred to Monitoring,100,Q2-2022,2022,365,454,Portfolio,Provides low cost internet access to low and middle income households in Kenya.,0,0,3/15/2021,4/16/2025,,006t0000004FBLL,,Portfolio Monitoring Specialist,,Office of Financial And Portfolio Management (OFPM),,OPIC Portfolio Monitoring,1,,Policy Clearance Completed,cbc71853-a4e1-4d10-a535-5a4c35e75a5f,45986,,,,SOC-3018,0,11/10/2021,C-Cleared,Clearance Completed,,,,,EN-03019,0,B,11/10/2021,C-Cleared,2021-11-10,Clearance Completed,a21t000000Et7tx,9000105274-IQ Adjustment Initial Score 2022,,,,,EC-05781,a1It000000B4kEq,Clearance Completed,2021-11-16,11/16/2021,C-Cleared,,116.35,116.35,Highly Developmental,0.1.4,,,0,0,1/31/2024,0,,1,,,,,9000105274,0,0,,,,,,0,,,,3/9/2022,,4/1/2021,,,3/9/2022,,,,Sub-IC,0,Low,,Kenya,Kenya,Africa,0,0,0,1,,,615,,1,Lower Middle Income,1,0,Reporting count updated January 2023,0,0,,,,,,,,,,
MA - 000103,"Apollo Agriculture, Inc.",a27eq000000kkEL,,,,Kenya,ODP,,0,0,0,0,0,,2024,,Customer Voice Facility Report,4/12/2024,2/15/2031,Stakeholder Survey,9000104719,,,0,0,,,,,,Office of Investment Policy,12/16/2024,,SMEF,,9500000,9500000,1,1,9/28/2021,,Transferred to Monitoring,100,Q4-2021,2021,371,736,Portfolio,Financial vehicle making small micro loans and inputs available to small holder farmers in Kenya.,0,0,9/22/2020,4/23/2025,,006t0000003DtSv,,Portfolio Monitoring Specialist,,Office of Financial And Portfolio Management (OFPM),,OPIC Portfolio Monitoring,1,,Submitted for Policy Clearance,225a6a11-e786-4c2e-ac27-c1f9624d02f5,38795,,,,SOC-2898,0,2/25/2021,C-Cleared,Clearance Completed,,,,,EN-02898,0,C,2/25/2021,C-Cleared,2021-02-25,Clearance Completed,a21t000000Et6lE,9000104719-IQ Adjustment Initial Score 2021,,,,,EC-05656,a1It000000B1xtI,Clearance Completed,2021-04-07,4/7/2021,C-Cleared,,129.4,129.42,Highly Developmental,0.1.4,,DUADJENL26X6,0,0,4/24/2023,0,,1,,,,,9000104719,0,0,,,,,,0,,,,9/10/2021,,9/29/2020,,,9/10/2021,,,,Sub-IC,0,Low,,Kenya,"Zambia, Kenya",Africa,0,0,0,1,,,615,,1,Lower Middle Income,1,0,,0,0,"Apollo Agriculture, Inc.",,SF,,001t000000UWNTB,,,United States,,A-035473
MA - 000080,"Apollo Agriculture, Inc.",a273d000002NlGl,,,,Kenya,ODP,,0,0,0,0,0,,2024,,,4/18/2024,2/15/2031,Development Impact Monitoring Review,9000104719,,,0,0,,,,,,,8/15/2024,,SMEF,,9500000,9500000,1,1,9/28/2021,,Transferred to Monitoring,100,Q4-2021,2021,371,736,Portfolio,Financial vehicle making small micro loans and inputs available to small holder farmers in Kenya.,0,0,9/22/2020,4/23/2025,,006t0000003DtSv,,Portfolio Monitoring Specialist,,Office of Financial And Portfolio Management (OFPM),,OPIC Portfolio Monitoring,1,,Submitted for Policy Clearance,225a6a11-e786-4c2e-ac27-c1f9624d02f5,38795,,,,SOC-2898,0,2/25/2021,C-Cleared,Clearance Completed,,,,,EN-02898,0,C,2/25/2021,C-Cleared,2021-02-25,Clearance Completed,a21t000000Et6lE,9000104719-IQ Adjustment Initial Score 2021,,,,,EC-05656,a1It000000B1xtI,Clearance Completed,2021-04-07,4/7/2021,C-Cleared,,129.4,129.42,Highly Developmental,0.1.4,,DUADJENL26X6,0,0,4/24/2023,0,,1,,,,,9000104719,0,0,,,,,,0,,,,9/10/2021,,9/29/2020,,,9/10/2021,,,,Sub-IC,0,Low,,Kenya,"Zambia, Kenya",Africa,0,0,0,1,,,615,,1,Lower Middle Income,1,0,,0,0,"Apollo Agriculture, Inc.",,SF,,001t000000UWNTB,,,United States,,A-035473
MA - 000078,Mawingu Networks,a273d000002NZXO,,,,Kenya,ODP,,0,0,0,0,0,,2024,,,4/11/2024,10/15/2031,Development Impact Monitoring Review,9000031411,,,0,0,,,,,,Office of Investment Policy,8/15/2024,,SF,,4100000,4100000,1,1,5/10/2016,,Transferred to Monitoring,100,Q3-2016,2016,300,2955,Portfolio,Construction of up to 340 WiFi access points,0,0,7/15/2015,2/13/2025,,006t0000001dstM,,"Director, Asset Management",,Office of Financial And Portfolio Management (OFPM),,OPIC Portfolio Monitoring,1,,Policy Clearance Completed,8f32cabc-d5b3-4e1d-a32b-08e56f59a1a3,7365,,,,LHR-0145,0,5/24/2016,C-Cleared,Clearance Completed,,,"Screening: The Project has been reviewed against OPIC’s categorical prohibitions and determined to be eligible.  Projects involving the installation of roof-top communication towers on commercial property and operation of existing communication towers are screened as Category B projects under OPIC’s environmental and social guidelines because impacts are site specific and readily mitigated.  The primary environmental and social concerns related to this Project are associated with the safety of employees and contractors involved in the installation of roof-top communication equipment.  Applicable Standards: OPIC’s environmental and social due diligence indicates that the Project will have impacts that must be managed in a manner consistent with the following International Finance Corporation’s (IFC) 2012 Performance Standards (PS):-PS 1: Assessment and Management of Environmental and Social Risks and Impacts;-PS 2: Labor and Working Conditions;-PS 3: Resource Efficiency and Pollution Prevention; and-PS 4: Community Health, Safety and Security.The Project will not involve any physical or economic displacement and no land will be purchased for the Project.  All construction activities will be undertaken on commercial property and the Borrower will reach a lease agreement with the local landlords through negotiations of commercial terms.  Therefore, IFC’s Performance Standard 5 is not triggered by the Project at this time.  The Project will install roof-top communication equipment on commercial properties located in rural areas which the Borrower has represented will be in permitted locations. At a few national parks, small-sized non-intrusive wireless communication equipment (antenna) will be installed in order to meet the communication needs of the park authorities. The roof-top communication equipment will be installed in a manner which is consistent with the visual landscape and the management of the relevant parks.  In addition, the Project sites are not expected to adversely impact any critical habitat or cultural heritage.  Therefore, PS 6: Biodiversity Conservation and Sustainable Management of Living Natural Resources and PS 8: Cultural Heritage are not triggered at this time.  No Indigenous Peoples will be adversely impacted at any of the Project sites.  Thus, PS7: Indigenous Peoples is also not triggered at this time.In accordance with PS 3, IFC’s Environmental, Health, and Safety (EHS) General Guidelines (2007) and EHS Guidelines for Telecommunications will be applicable to this Project.The Project is not expected to have significant greenhouse gas (carbon dioxide equivalent) emissions as it plans to use solar panels for charging its wireless communication equipment and achieve carbon neutral status.Environmental and Social Risks and Mitigation: The Borrower will manage both the construction of new roof-top communication equipment and their operation in accordance with its policies which also ensure compliance with both the local regulations and IFC Performance Standards and Guidelines. The Borrower has adopted detailed procedures relating to worker and contractor safety.  In addition, employees and contractors will also receive extensive training specific to their jobs.  All solid wastes will be transported off site and disposed at permitted facilities by licensed contractors.  The Project does not generate significant quantities of wastewaters.  Dust and other air emissions will be controlled to acceptable levels.   The Borrower will be required to continue implementing its overarching environmental and sustainability policies that will be used to guide the Project’s environmental and social performance.  The Borrower will also be required to continue implementing its grievance mechanism.  In addition, the Borrower will also be required to ensure compliance with IFC’s Performance Standards (2012) and Environmental, Health, and Safety (EHS) Guidelines for Telecommunications and General EHS Guidelines (2007).","Aggarwal, Sanjeev",EN-00145,0,B,5/10/2016,C-Cleared,2016-05-10,Clearance Completed,a21t000000HGgqJ,9000031411 Form_008_Submission_Adjustment 2021,,,"The Project is not expected to have a negative impact on the U.S. economy or employment.  There is no U.S. procurement associated with this project, and, therefore the project is expected to have a neutral impact on U.S. employment.  The project is expected to have a negative five-year U.S. balance of payments impact.","This Project is expected to have a highly developmental impact in Kenya, a low income country, by providing affordable, high-speed Wi-Fi hotspots to consumers in rural areas. The Project will also provide free device charging to its clients in a country where in 2012, only 6.7 percent of its rural population had access to electricity. The Project will utilize new technology and a new business model to reach areas currently underserved by broadband service providers. The Project is also expected to create new professional and technical job opportunities in Kenya. Until recently, Mawingu was a non-commercial technical pilot program, funded by donors and impact investors in order to prove out the technology.",EC-03992,,Clearance Completed,2016-03-17,3/17/2016,C-Cleared,,75,130.39,Highly Developmental,0.1.4,,,0,0,3/27/2017,0,,1,,,,,9000031411,0,0,,,,,,0,,,,6/14/2016,,,,,6/14/2016,,,,Sub-IC,0,Low,,Kenya,Kenya,Africa,0,1,1,1,,,615,,1,,0,1,,0,0,International Network Investments,,SF,,001t0000004hRbM,,,United States,,A-001092
MA - 000077,Poa Internet Kenya Limited,a273d000002NYYn,,,,Kenya,ODP,,0,0,0,0,0,,2024,,,4/16/2024,4/15/2029,Development Impact Monitoring Review,9000105274,,,0,0,,,,,,Office of Investment Policy,8/15/2024,,SMEF,,5000000,5000000,1,1,3/15/2022,,Transferred to Monitoring,100,Q2-2022,2022,365,454,Portfolio,Provides low cost internet access to low and middle income households in Kenya.,0,0,3/15/2021,4/16/2025,,006t0000004FBLL,,Portfolio Monitoring Specialist,,Office of Financial And Portfolio Management (OFPM),,OPIC Portfolio Monitoring,1,,Policy Clearance Completed,cbc71853-a4e1-4d10-a535-5a4c35e75a5f,45986,,,,SOC-3018,0,11/10/2021,C-Cleared,Clearance Completed,,,,,EN-03019,0,B,11/10/2021,C-Cleared,2021-11-10,Clearance Completed,a21t000000Et7tx,9000105274-IQ Adjustment Initial Score 2022,,,,,EC-05781,a1It000000B4kEq,Clearance Completed,2021-11-16,11/16/2021,C-Cleared,,116.35,116.35,Highly Developmental,0.1.4,,,0,0,1/31/2024,0,,1,,,,,9000105274,0,0,,,,,,0,,,,3/9/2022,,4/1/2021,,,3/9/2022,,,,Sub-IC,0,Low,,Kenya,Kenya,Africa,0,0,0,1,,,615,,1,Lower Middle Income,1,0,Reporting count updated January 2023,0,0,,,,,,,,,,
MA - 000067,"Apollo Agriculture, Inc.",a273d000002ADlJ,,,,Kenya,ODP,,0,0,0,0,0,,2024,,Office-based meeting,5/15/2024,2/15/2031,Environmental & Social Compliance Project Evaluation,9000104719,,,0,0,,,,,,,6/26/2024,,SMEF,,9500000,9500000,1,1,9/28/2021,,Transferred to Monitoring,100,Q4-2021,2021,371,736,Portfolio,Financial vehicle making small micro loans and inputs available to small holder farmers in Kenya.,0,0,9/22/2020,4/23/2025,,006t0000003DtSv,,Portfolio Monitoring Specialist,,Office of Financial And Portfolio Management (OFPM),,OPIC Portfolio Monitoring,1,,Submitted for Policy Clearance,225a6a11-e786-4c2e-ac27-c1f9624d02f5,38795,,,,SOC-2898,0,2/25/2021,C-Cleared,Clearance Completed,,,,,EN-02898,0,C,2/25/2021,C-Cleared,2021-02-25,Clearance Completed,a21t000000Et6lE,9000104719-IQ Adjustment Initial Score 2021,,,,,EC-05656,a1It000000B1xtI,Clearance Completed,2021-04-07,4/7/2021,C-Cleared,,129.4,129.42,Highly Developmental,0.1.4,,DUADJENL26X6,0,0,4/24/2023,0,,1,,,,,9000104719,0,0,,,,,,0,,,,9/10/2021,,9/29/2020,,,9/10/2021,,,,Sub-IC,0,Low,,Kenya,"Zambia, Kenya",Africa,0,0,0,1,,,615,,1,Lower Middle Income,1,0,,0,0,"Apollo Agriculture, Inc.",,SF,,001t000000UWNTB,,,United States,,A-035473
MA - 000048,Kasha Global Inc.,a273d000001SuHs,,,,Kenya,ODP,,0,0,0,0,0,,2023,,,4/24/2023,1/11/2041,Development Impact Project Evaluation,9000103763,,,0,0,,,,,,Origination Officer SF,1/4/2024,,Equity,,1000000,1000000,1,1,1/22/2021,,Disbursing (after 1st Disbursement),100,Q2-2021,2021,511,106,Portfolio,"Kasha is an e-commerce company providing personal care, health care and beauty products to low-income women in Kenya and Rwanda",0,0,8/30/2019,4/28/2025,,006t0000002bmcM,,"Director, Venture And Private Equity",Direct Equity Investments (OEIF),Office of Infrastructure (OI),,Equity - Funds,1,,Policy Clearance Completed,d787a2f6-8d7f-4235-9289-86a8eff3fd8f,37531,,,,SOC-2776,0,8/10/2020,C-Cleared,Clearance Completed,,,,,EN-02776,0,B,8/10/2020,C-Cleared,2020-08-10,Clearance Completed,a21t000000Et6xA,9000103763-IQ Adjustment Initial Score 2021,,,,,EC-05534,a1It0000009nxIh,Clearance Completed,2020-07-31,7/31/2020,C-Cleared,,136.3,135.55,Highly Developmental,0.1.4,,,0,0,1/12/2022,0,,1,,,,,9000103763,0,0,,8/28/2020,,,,0,9/9/2020,,,8/6/2020,,5/21/2020,,,9/9/2020,,,,IC,0,Low,,Kenya,"Kenya, Rwanda",Africa,0,1,0,1,,,615,,0,Lower Middle Income,0,0,"Updated reporting count April 2025, this project will report under Kasha Global (9000115665).
Updated reporting count and project relationship January, 2023",0,0,,,,,,,,,,
MA - 000044,WBC - Victoria Commercial Bank Ltd,a273d000001DoD3,,,,Kenya,ODP,,0,0,0,0,0,,2023,,,4/17/2023,6/20/2028,Development Impact Monitoring Review,9000072932,,,0,0,,,,,,Office of Investment Policy,9/21/2023,,SMEF,,9750000,9750000,1,1,4/18/2018,,Closed Out,100,Q3-2018,2018,96,83,Omitted,Expansion of SME lending portfolio to women-owned businesses and green energy projects,0,0,1/12/2018,2/5/2025,,006t0000002fPzR,,Loan Monitoring Officer,,Office of Financial And Portfolio Management (OFPM),,OPIC Portfolio Monitoring,1,,Policy Clearance Completed,bcf02835-5333-43c7-befc-def2c303cc71,18683,,,,LHR-2314,0,3/18/2018,C-Cleared,Clearance Completed,,,,,EN-02314,0,C,3/16/2018,C-Cleared,2018-03-16,Clearance Completed,a21t000000HGgxt,9000072932 Form_008_Submission_Adjustment 2021,,,,,EC-04836,a1It0000000LRZf,Clearance Completed,2018-02-27,2/27/2018,C-Cleared,,67.5,0,Not Scored,0.1.4,,,0,0,7/11/2018,0,,1,,,,,9000072932,0,0,,,,,,0,,,,4/18/2018,,,,,4/18/2018,,,,Sub-IC,0,Low,,Kenya,Kenya,Africa,0,1,1,1,,,615,9750000,1,,0,1,,0,0,FSVC,,SF,,001t000000AqQwc,,,United States,,A-032665
