MA - 000158,FS India Solar Ventures Private Limited,a27eq0000033aV3,,,,India,ODP,,0,0,0,0,0,,2023,,,5/1/2023,8/8/2029,Environmental & Social Compliance Project Evaluation,9000115523,,,0,0,,,,,,,4/2/2025,,SF,,500000000,500000000,1,1,12/15/2021,,Transferred to Monitoring,100,Q1-2022,2022,86,950,Portfolio,3.3GW/Annum First Solar thin-film module manufacturing facility in India.,0,0,9/20/2021,2/13/2025,,006t0000004FIKf,Origination Officer SF,"Director, Asset Management",,Office of Financial And Portfolio Management (OFPM),,OPIC Portfolio Monitoring,1,,Policy Clearance Completed,2fc55793-4c8d-4d4b-9e75-188ad77e2230,49218,,,,SOC-3102,1,11/3/2021,C-Cleared,Clearance Completed,,,,,EN-03103,0,B,11/2/2021,C-Cleared,2021-11-02,Clearance Completed,a21t000000Et9Wg,9000115523-IQ Adjustment Initial Score 2022,,,,,EC-05866,a1It000000B4idn,Clearance Completed,2021-11-16,11/16/2021,C-Cleared,,141,141.06,Highly Developmental,0.1.4,,,0,0,9/22/2022,0,,1,,,,,9000115523,0,0,,10/25/2021,,,,0,11/15/2021,,,10/15/2021,,9/30/2021,,,11/15/2021,,,,Board,0,Middle,,India,India,Asia,0,0,0,1,,,386,,1,Lower Middle Income,1,1,Reporting count updated January 2023,0,0,First Solar Inc.,,,,00170000012rf47,United States,,USA,,A-001559
MA - 000157,IndusInd-Waycool Foods and Products Private Limited,a27eq00000320dJ,,,,India,ODP,,0,0,0,0,0,,2025,,,12/16/2024,6/10/2025,Environmental & Social Compliance Project Evaluation,9000093562,,,0,0,,,,,,Office of Investment Policy,4/1/2025,,SMEF,,5500000,5500000,1,1,8/19/2019,,Transferred to Monitoring,100,Q4-2019,2019,164,1664,Portfolio,"Expansion of a food distribution company delivering staples, fruit and vegetables and dairy products.",0,0,3/8/2019,4/23/2025,,006t0000003C6zX,,"Director, Asset Management",,Office of Financial And Portfolio Management (OFPM),,OPIC Portfolio Monitoring,1,,Policy Clearance Completed,92527ba5-58ab-4c6e-8d6f-2649be9bb138,29244,,,,SOC-2589,0,8/9/2019,C-Cleared,Clearance Completed,,,,,EN-02589,0,B,7/2/2019,C-Cleared,2019-07-02,Clearance Completed,a213d000002ZtEt,9000093562-IQ Adjustment Initial Score 2019,,,,,EC-05343,a1It0000005Dced,Clearance Completed,2019-07-26,7/26/2019,C-Cleared,,67.5,133.95,Highly Developmental,0.1.4,,,0,0,10/8/2020,0,,1,,,,,9000093562,0,0,,,,,,0,,,,8/2/2019,,3/25/2019,,,8/2/2019,,,,Sub-IC,0,Low,,India,India,Asia,0,0,1,1,,,386,5500000,1,Lower Middle Income,0,1,,0,0,Soros Economic Development Fund,,SF,,001t0000001vbv3,,,USA,,A-018307
MA - 000156,Soothe Healthcare Private Limited,a27eq00000320a5,,,,India,ODP,,0,0,0,0,0,,2025,,,12/12/2024,6/15/2030,Environmental & Social Compliance Project Evaluation,9000115786,,,0,0,,,,,,Office of Investment Policy,4/1/2025,,SMEF,,7700000,7700000,1,1,9/16/2022,,Transferred to Monitoring,100,Q4-2022,2022,224,412,Portfolio,Expansion of India-based social enterprise that manufactures safe and affordable women’s hygiene products for underserved women in non-metro areas.,0,0,2/4/2022,4/21/2025,,006t0000004FaNi,,Portfolio Monitoring Specialist,,Office of Financial And Portfolio Management (OFPM),,OPIC Portfolio Monitoring,1,,Policy Clearance Completed,d753e4dc-b009-4946-ab24-9adb101f2417,51306,,,,SOC-3188,1,8/31/2022,C-Cleared,Clearance Completed,,,,,EN-03189,0,B,9/1/2022,C-Cleared,2022-09-01,Clearance Completed,a21t000000FlO7N,9000115786-IQ Adjustment Initial Score 2022,,,,,EC-05958,a1It000000FmzHq,Clearance Completed,2022-08-31,8/31/2022,C-Cleared,,119.49,119.49,Highly Developmental,0.1.4,,,0,0,3/13/2024,0,,1,,,,,9000115786,0,0,,,,,,0,,,,8/11/2022,,2/14/2022,,,8/11/2022,,,,Sub-IC,0,Low,,India,India,Asia,0,0,1,1,,,386,,1,Lower Middle Income,1,0,Reporting count updated January 2023,0,0,,,,,,,,,,
MA - 000150,Sewa Grih Rin Limited,a27eq000001sj7d,,,,India,ODP,,0,0,0,0,0,,2024,,,9/30/2024,2/5/2035,Stakeholder Survey,9000083099,,,0,0,,,,,,Office of Investment Policy,1/2/2025,,SMEF,,30000000,30000000,1,1,9/13/2019,,Transferred to Monitoring,100,Q4-2019,2019,472,1772,Portfolio,SEWA Grih Rin (“SGR”) is an Indian housing finance company that provides micro-housing loans to low-income women borrowers.,0,0,5/29/2018,3/18/2025,,006t0000002sZVB,,"Managing Director, Financial Institutions Portfolio Management",,Office of Financial And Portfolio Management (OFPM),,OPIC Portfolio Monitoring,1,,Policy Clearance Completed,4e3f726a-8608-4243-852a-149cfddef46b,25875,,,,SOC-2443,0,1/15/2019,C-Cleared,Clearance Completed,,,,,EN-02443,0,C,1/15/2019,C-Cleared,2019-01-15,Clearance Completed,a21t000000HGgsF,9000083099 Form_008_Submission_Adjustment 2021,,,,,EC-05122,a1It0000001fSXJ,Clearance Completed,2019-08-13,8/13/2019,C-Cleared,,70,0,Not Scored,0.1.4,,,0,0,6/22/2020,0,,1,,,,,9000083099,0,0,,8/13/2019,,,,0,,,,7/22/2019,,6/5/2018,,,7/22/2019,,,,IC,0,Low,,India,India,Asia,0,0,1,1,,,386,30000000,1,,0,1,,0,0,"AHI Capital Gateway, Inc",,SF,,001t000000C4V89,,,United States,,A-033264
MA - 000149,SEWA Grih Rin Limited,a27eq000001sj61,,,,India,ODP,,0,0,0,0,0,,2024,,,9/30/2024,,Stakeholder Survey,9000116595,,,0,0,,,,,,Office of Investment Policy,1/2/2025,,SMEF,,50000000,10000000,0,0,10/9/2025,,Screened,20,Q1-2026,2026,609,565,Pipeline,SEWA Grih Rin is returning to DFC for a second facility to further expand their portfolio of micro-housing loans to low-income women borrowers.,0,0,8/29/2023,3/25/2025,,0063d000002OfvV,Administrative,Project Finance Specialist,,Office of Health & Agribusiness (OHA),,SMEF User,1,,Policy Clearance Completed,,,,,,SOC-3613,0,3/6/2024,C-Cleared,Clearance Completed,,,,,EN-03616,0,FI C/Fund C,3/6/2024,C-Cleared,2024-03-06,Clearance Completed,a213d000002U06x,9000116595-IQ Adjustment Initial Score 2024,,,,,EC-06642,a1I3d000000Ulwm,Clearance Completed,2024-04-09,4/9/2024,C-Cleared,,,120.42,Highly Impactful,0.1.4,,,0,0,,0,,1,,,,,9000116595,0,0,,,,,,0,,,,,,10/12/2023,,,,,,,IC,0,Middle,,India,India,Asia,0,0,0,1,,,386,,,Lower Middle Income,0,0,,0,0,,,,,,,,,,
MA - 000123,Maanaveeya Development & Finance Private Limited,a27eq000001E3Or,,,,India,ODP,,0,0,0,0,0,,2024,,,8/19/2024,9/30/2028,Development Impact Monitoring Review,9000104490,,,0,0,,,,,,Office of Investment Policy,10/25/2024,,SMEF,,7500000,7500000,1,1,2/15/2021,,Transferred to Monitoring,100,Q2-2021,2021,251,1211,Portfolio,"Maanaveeya is an Indian subsidiary of Oikocredit, which responds to the needs of businesses that create jobs and income for disadvantaged people.",0,0,6/9/2020,4/10/2025,,006t0000003QKc3,,"Director, Relationships (Asia/Mena)",,Office of Small Business and Financial Services (OSBFS),,SMEF User,1,,Policy Clearance Completed,d604daf8-0c16-4ef9-93c8-ddfe35f57eb3,38230,1cbee824-efae-468f-b12f-29b08da761da,,,SOC-2892,0,12/10/2020,C-Cleared,Clearance Completed,,,,,EN-02892,0,C,12/10/2020,C-Cleared,2020-12-10,Clearance Completed,a21t000000Et9wt,9000104490-IQ Adjustment Initial Score 2021,,,,,EC-05650,a1It000000B1zOr,Clearance Completed,2021-02-18,2/18/2021,C-Cleared,,119.4,119.38,Highly Developmental,0.1.4,,,0,0,1/4/2022,0,,1,,,,,9000104490,0,0,,,,,,0,,,,,,,,,,,,,Sub-IC,0,Middle,,India,India,Asia,0,0,0,1,,,386,,1,Lower Middle Income,1,0,,0,0,USAID-India,,SF,,001t000000MYUIe,India,,India,,A-034684
MA - 000122,Northern Arc Capital Limited,a27eq000001A61x,,,,India,ODP,,0,0,0,0,0,,2024,,,8/14/2024,11/14/2025,Development Impact Monitoring Review,9000103738,,,0,0,,,,,,Office of Investment Policy,10/22/2024,,SMEF,,50000000,50000000,1,1,5/8/2020,,Transferred to Monitoring,100,Q3-2020,2020,277,1478,Portfolio,"Expansion of an Indian NBFI's portfolio with a focus on loans for women owned businesses, food security and water, sanitation and hygiene.",0,0,8/5/2019,4/23/2025,,006t0000002agZp,,Loan Monitoring Officer,,Office of Financial And Portfolio Management (OFPM),,OPIC Portfolio Monitoring,1,,Policy Clearance Completed,928c625d-282d-4b1c-9714-cd8fff81d301,33580,,,,SOC-2683,0,3/2/2020,C-Cleared,Clearance Completed,,,,,EN-02683,0,C,3/2/2020,C-Cleared,2020-03-02,Clearance Completed,a213d0000026YIz,9000103738-IQ Adjustment Initial Score 2020,,,,,EC-05441,a1It0000007YtxI,Clearance Completed,2020-03-17,3/17/2020,C-Cleared,,,142.94,Highly Developmental,0.1.4,,,0,0,4/12/2021,0,,1,,,,,9000103738,0,0,,3/13/2020,,,,0,,,,3/5/2020,,9/26/2019,,,3/13/2020,,,,IC,0,Middle,,India,India,Asia,0,0,0,1,,,386,50000000,1,Lower Middle Income,0,1,,0,0,ACCION International,,SF,,001t0000001vXtH,,,United States,,A-018014
MA - 000121,Biological E. Limited,a27eq000001A5gz,,,,India,ODP,,0,0,0,0,0,,2024,,,8/20/2024,7/30/2032,Development Impact Monitoring Review,9000105321,,,0,0,,,,,,,10/22/2024,,SMEF,,50000000,50000000,1,1,9/10/2021,,Transferred to Monitoring,100,Q4-2021,2021,157,1023,Portfolio,COVID-19 vaccine manufacturing in India for primary distribution across Asia by 2021 end.  Increasing vaccine doses by 1.5 billion annual production.,0,0,4/6/2021,3/24/2025,,006t0000004FC7M,VP SF,"Managing Director, Asset Management",,Office of Financial And Portfolio Management (OFPM),,OPIC Portfolio Monitoring,1,,Policy Clearance Completed,a4fc34c3-9fed-464e-a61a-1abc38d21d95,46015,,,,SOC-3026,0,7/27/2021,C-Cleared,Clearance Completed,,,,,EN-03027,0,B,7/29/2021,C-Cleared,2021-07-29,Clearance Completed,a21t000000Et7sp,9000105321-IQ Adjustment Initial Score 2021,,,,,EC-05788,a1It000000B2DjD,Clearance Completed,2021-08-10,8/10/2021,C-Cleared,,138.8,138.75,Highly Developmental,0.1.4,,,0,0,7/11/2022,0,,1,,,,,9000105321,0,0,,7/30/2021,,,,0,,,,7/22/2021,,5/1/2021,,,7/30/2021,,,,IC,0,Middle,,India,India,Asia,0,0,0,1,,,386,,1,Lower Middle Income,1,0,,0,0,Bio E Holdings Inc.,,,,001t000000eHyZz,,,United States,,A-035788
MA - 000109,Milk Mantra Dairy Private Limited,a27eq000000koQ1,,,,India,ODP,,0,0,0,0,0,,2024,,Customer Voice Facility,7/30/2024,4/15/2029,Stakeholder Survey,9000103842,,,0,0,,,,,,Office of Investment Policy,12/16/2024,,SMEF,,10000000,10000000,1,1,6/5/2020,,Closed Out,100,Q3-2020,2020,186,83,Omitted,Expansion of a dairy company sourcing from smallholder farmers in northeast India.,0,0,12/2/2019,2/13/2025,,006t0000003Rlu8,,Portfolio Monitoring Specialist,,Office of Financial And Portfolio Management (OFPM),,OPIC Portfolio Monitoring,1,,,,,,,,SOC-2684,0,5/1/2020,C-Cleared,Clearance Completed,,,,,EN-02684,0,B,5/19/2020,C-Cleared,2020-05-19,Clearance Completed,a21t000000Et6aG,9000103842 Adjustment Re-Score 2029,,,,,EC-05442,a1It0000007w2p1,Clearance Completed,2020-04-28,4/28/2020,C-Cleared,,143.5,143.5,Highly Developmental,0.1.4,,,0,0,2/10/2023,0,,1,,,,,9000103842,0,0,,,,,,0,,,,5/27/2020,,12/19/2019,,,5/27/2020,,,,Sub-IC,0,Middle,,India,India,Asia,0,0,0,1,,,386,10000000,1,Lower Middle Income,0,1,,0,0,Eight Roads Investments Mauritius II,,SF,,001t000000QRBRr,,,Mauritius,,A-035274
MA - 000110,RBL Bank,a27eq000000km9k,,,,India,ODP,,0,0,0,0,0,,2024,,Customer Voice Facility,9/30/2024,2/15/2032,Stakeholder Survey,9000104374,,,0,0,,,,,,Office of Investment Policy,12/16/2024,,SF,,100000000,100000000,1,1,12/31/2021,,Transferred to Monitoring,100,Q1-2022,2022,634,1034,Portfolio,Loan for Tier II capital to alleviate liquidity constraints,0,0,4/6/2020,4/29/2025,,006t0000003Pfhk,,Senior Investment Officer,,Office of Financial And Portfolio Management (OFPM),,OPIC Portfolio Monitoring,1,,Policy Clearance Completed,ca20a2e3-b261-43cb-8404-8c35c5cdc60d,37354,,,,SOC-2852,0,10/13/2020,C-Cleared,Clearance Completed,,,,,EN-02852,0,C,10/13/2020,C-Cleared,2020-10-13,Clearance Completed,a21t000000Et9PQ,9000104374-IQ Adjustment Initial Score 2022,,,,,EC-05610,a1It000000B1wUp,Clearance Completed,2021-01-13,1/13/2021,C-Cleared,,120.3,120.28,Highly Developmental,0.1.4,,,0,0,6/30/2022,0,,1,,,,,9000104374,0,0,,10/8/2021,,,,0,11/15/2021,,,10/1/2021,,4/6/2020,,,11/15/2021,,,,Board,0,Middle,,India,India,Asia,0,0,0,1,,,386,,1,Lower Middle Income,1,0,Reporting count updated January 2023,0,0,,,,,,,,,,
MA - 000101,UC Inclusive Credit Private Limited,a27eq000000Va8r,,,,India,ODP,,0,0,0,0,0,,2024,,,7/12/2024,7/15/2028,Development Impact Monitoring Review,9000103750,,,0,0,,,,,,Office of Investment Policy,9/18/2024,,SMEF,,5000000,5000000,1,1,12/31/2020,,Transferred to Monitoring,100,Q1-2021,2021,505,1161,Portfolio,"UC Inclusive Credit lends to entities focused on agriculture, education, financial inclusion, healthcare, renewable energy, and women empowerment.",0,0,8/14/2019,4/16/2025,,006t0000002b54b,,Portfolio Monitoring Specialist,,Office of Financial And Portfolio Management (OFPM),,OPIC Portfolio Monitoring,1,,Policy Clearance Completed,93ec8680-7cb6-42f5-a741-95ceeafffd57,33657,,,,SOC-2690,0,6/23/2020,C-Cleared,Clearance Completed,,,,,EN-02690,0,C,6/23/2020,C-Cleared,2020-06-23,Clearance Completed,a21t000000Et9z9,9000103750-IQ Adjustment Initial Score 2021,,,,,EC-05448,a1It0000008c0cT,Clearance Completed,2020-07-02,7/2/2020,C-Cleared,,116.3,116.97,Highly Developmental,0.1.4,,,0,0,2/23/2022,0,,1,,,,,9000103750,0,0,,,,,,0,,,,12/2/2020,,9/6/2019,,,12/2/2020,,,,Sub-IC,0,Middle,,India,India,Asia,0,0,0,1,,,386,,1,Lower Middle Income,0,1,,0,0,Unitus Investment Management,,SF,,001t000000IbsfX,,,United States,,A-034305
MA - 000100,RBL Bank,a27eq000000PdZF,,,,India,ODP,,0,0,0,0,0,,2024,,,7/8/2024,2/15/2032,Development Impact Monitoring Review,9000104374,,,0,0,,,,,,Office of Investment Policy,9/16/2024,,SF,,100000000,100000000,1,1,12/31/2021,,Transferred to Monitoring,100,Q1-2022,2022,634,1034,Portfolio,Loan for Tier II capital to alleviate liquidity constraints,0,0,4/6/2020,4/29/2025,,006t0000003Pfhk,,Senior Investment Officer,,Office of Financial And Portfolio Management (OFPM),,OPIC Portfolio Monitoring,1,,Policy Clearance Completed,ca20a2e3-b261-43cb-8404-8c35c5cdc60d,37354,,,,SOC-2852,0,10/13/2020,C-Cleared,Clearance Completed,,,,,EN-02852,0,C,10/13/2020,C-Cleared,2020-10-13,Clearance Completed,a21t000000Et9PQ,9000104374-IQ Adjustment Initial Score 2022,,,,,EC-05610,a1It000000B1wUp,Clearance Completed,2021-01-13,1/13/2021,C-Cleared,,120.3,120.28,Highly Developmental,0.1.4,,,0,0,6/30/2022,0,,1,,,,,9000104374,0,0,,10/8/2021,,,,0,11/15/2021,,,10/1/2021,,4/6/2020,,,11/15/2021,,,,Board,0,Middle,,India,India,Asia,0,0,0,1,,,386,,1,Lower Middle Income,1,0,Reporting count updated January 2023,0,0,,,,,,,,,,
MA - 000096,IndusInd Bank - Kinara Capital Private Limited,a27eq00000066tx,,,,India,ODP,,0,0,0,0,0,,2024,,,7/15/2024,10/15/2025,Environmental & Social Compliance Project Evaluation,9000093393,,,0,0,,,,,,Administrative,8/29/2024,,SMEF,,11000000,11000000,1,1,9/20/2019,,Transferred to Monitoring,100,Q4-2019,2019,276,1470,Portfolio,"Expansion of micro and small business loan portfolio serving 18,500 clients in southern India.",0,0,12/18/2018,4/14/2025,,006t00000037D2u,,"Managing Director, Financial Institutions Portfolio Management",,Office of Financial And Portfolio Management (OFPM),,OPIC Portfolio Monitoring,1,,Policy Clearance Completed,ed58863b-fe27-4209-b864-48377c3b4f67,27752,,,,SOC-2562,0,6/17/2019,C-Cleared,Clearance Completed,,,,,EN-02562,0,C,6/17/2019,C-Cleared,2019-06-17,Clearance Completed,a21t000000HGgvY,9000093393 Form_008_Submission_Adjustment 2021,,,,,EC-05310,a1It0000004pYWU,Clearance Completed,2019-06-28,6/28/2019,C-Cleared,,67.5,0,Not Scored,0.1.4,,,0,0,4/20/2021,0,,1,,,,,9000093393,0,0,,,,,,0,,,,8/27/2019,,12/18/2018,,,8/27/2019,,,,Sub-IC,0,Low,,India,India,Asia,0,0,1,1,,,386,11000000,1,,0,1,,0,0,Kinara Capital,,SF,,001t000000EcaR6,,,United States,,A-033845
MA - 000095,UC Inclusive Credit Private Limited,a27eq00000066fR,,,,India,ODP,,0,0,0,0,0,,2023,,,7/12/2024,7/15/2028,Environmental & Social Compliance Project Evaluation,9000103750,,,0,0,,,,,,Administrative,8/29/2024,,SMEF,,5000000,5000000,1,1,12/31/2020,,Transferred to Monitoring,100,Q1-2021,2021,505,1161,Portfolio,"UC Inclusive Credit lends to entities focused on agriculture, education, financial inclusion, healthcare, renewable energy, and women empowerment.",0,0,8/14/2019,4/16/2025,,006t0000002b54b,,Portfolio Monitoring Specialist,,Office of Financial And Portfolio Management (OFPM),,OPIC Portfolio Monitoring,1,,Policy Clearance Completed,93ec8680-7cb6-42f5-a741-95ceeafffd57,33657,,,,SOC-2690,0,6/23/2020,C-Cleared,Clearance Completed,,,,,EN-02690,0,C,6/23/2020,C-Cleared,2020-06-23,Clearance Completed,a21t000000Et9z9,9000103750-IQ Adjustment Initial Score 2021,,,,,EC-05448,a1It0000008c0cT,Clearance Completed,2020-07-02,7/2/2020,C-Cleared,,116.3,116.97,Highly Developmental,0.1.4,,,0,0,2/23/2022,0,,1,,,,,9000103750,0,0,,,,,,0,,,,12/2/2020,,9/6/2019,,,12/2/2020,,,,Sub-IC,0,Middle,,India,India,Asia,0,0,0,1,,,386,,1,Lower Middle Income,0,1,,0,0,Unitus Investment Management,,SF,,001t000000IbsfX,,,United States,,A-034305
MA - 000092,Motilal Oswal Home Finance Limited,a27eq000000622L,,,,India,ODP,,0,0,0,0,0,,2023,,,7/9/2024,12/15/2036,Environmental & Social Compliance Project Evaluation,9000104432,,,0,0,,,,,,Administrative,8/29/2024,,SMEF,,50000000,50000000,1,1,6/1/2021,,Transferred to Monitoring,100,Q3-2021,2021,393,1000,Portfolio,Long term funding for low middle income mortgages throughout India.,0,0,5/4/2020,4/14/2025,,006t0000003QCvz,,Portfolio Monitoring Specialist,,Office of Financial And Portfolio Management (OFPM),,OPIC Portfolio Monitoring,1,,Policy Clearance Completed,4fa2ef4e-4111-4445-8dd8-fd8fd49b255e,36030,,,,SOC-2846,0,9/16/2020,C-Cleared,Clearance Completed,,,,,EN-02846,0,C,9/16/2020,C-Cleared,2020-09-16,Clearance Completed,a21t000000Et7XS,9000104432-IQ Adjustment Initial Score 2021,,,,,EC-05604,a1It000000ASDfQ,Clearance Completed,2021-01-29,1/29/2021,C-Cleared,,124.7,126,Highly Developmental,0.1.4,,FPKDHWYWFQN4,0,0,8/3/2022,0,,1,,,,,9000104432,0,0,,4/23/2021,,,,0,,,,3/3/2021,,7/16/2020,,,4/23/2021,,,,IC,0,Middle,,India,India,Asia,0,0,0,1,,,386,,1,Lower Middle Income,1,0,,0,0,MOTILAL OSWAL HOME FINANCE LTD,,SF,,001t000000PrejI,,,India,,A-035214
MA - 000091,WBC - Avanse Financial Services Limited,a27eq00000060IH,,,,India,ODP,,0,0,0,0,0,,2024,,,7/10/2024,6/20/2030,Environmental & Social Compliance Project Evaluation,9000093671,,,0,0,,,,,,Administrative,8/29/2024,,SMEF,,14625000,14625000,1,1,5/15/2020,,Transferred to Monitoring,100,Q3-2020,2020,330,1478,Portfolio,This NBFC will provide loans to Indian students for college education.,0,0,6/20/2019,4/29/2025,,006t0000003IzOd,,Portfolio Monitoring Specialist,,Office of Financial And Portfolio Management (OFPM),,OPIC Portfolio Monitoring,1,Please revise to reflect change in scope of project to providing student loans only.,Policy Clearance Completed,8d8f918e-b4ec-4aa4-bed7-d38215d0ec4b,32394,,,,SOC-2636,0,11/4/2019,C-Cleared,Clearance Completed,,,,,EN-02636,0,C,11/4/2019,C-Cleared,2019-11-04,Clearance Completed,a21t000000HGgrl,9000093671 Form_008_Submission_Adjustment 2021,,,,,EC-05394,a1It0000006aa1l,Clearance Completed,2019-12-06,12/6/2019,C-Cleared,,62.5,92.81,Developmental,0.1.4,,,0,0,4/12/2021,0,,1,,,,,9000093671,0,0,,,,,,0,,,,3/16/2020,,1/8/2020,,,3/16/2020,,,,Sub-IC,0,Low,,India,India,Asia,0,0,1,1,,,386,14625000,1,Lower Middle Income,1,1,,0,0,Warburg Pincus,,SF,,001t0000001ufWE,,,United States,,A-015466
MA - 000086,WBC - Avanse Financial Services Limited,a273d000002O8Zc,,,,India,ODP,,0,0,0,0,0,,2024,,,7/10/2024,6/20/2030,Development Impact Monitoring Review,9000093671,,,0,0,,,,,,Office of Investment Policy,8/16/2024,,SMEF,,14625000,14625000,1,1,5/15/2020,,Transferred to Monitoring,100,Q3-2020,2020,330,1478,Portfolio,This NBFC will provide loans to Indian students for college education.,0,0,6/20/2019,4/29/2025,,006t0000003IzOd,,Portfolio Monitoring Specialist,,Office of Financial And Portfolio Management (OFPM),,OPIC Portfolio Monitoring,1,Please revise to reflect change in scope of project to providing student loans only.,Policy Clearance Completed,8d8f918e-b4ec-4aa4-bed7-d38215d0ec4b,32394,,,,SOC-2636,0,11/4/2019,C-Cleared,Clearance Completed,,,,,EN-02636,0,C,11/4/2019,C-Cleared,2019-11-04,Clearance Completed,a21t000000HGgrl,9000093671 Form_008_Submission_Adjustment 2021,,,,,EC-05394,a1It0000006aa1l,Clearance Completed,2019-12-06,12/6/2019,C-Cleared,,62.5,92.81,Developmental,0.1.4,,,0,0,4/12/2021,0,,1,,,,,9000093671,0,0,,,,,,0,,,,3/16/2020,,1/8/2020,,,3/16/2020,,,,Sub-IC,0,Low,,India,India,Asia,0,0,1,1,,,386,14625000,1,Lower Middle Income,1,1,,0,0,Warburg Pincus,,SF,,001t0000001ufWE,,,United States,,A-015466
MA - 000085,Motilal Oswal Home Finance Limited,a273d000002O8S0,,,,India,ODP,,0,0,0,0,0,,2024,,,7/9/2024,12/15/2036,Development Impact Monitoring Review,9000104432,,,0,0,,,,,,Office of Investment Policy,8/16/2024,,SMEF,,50000000,50000000,1,1,6/1/2021,,Transferred to Monitoring,100,Q3-2021,2021,393,1000,Portfolio,Long term funding for low middle income mortgages throughout India.,0,0,5/4/2020,4/14/2025,,006t0000003QCvz,,Portfolio Monitoring Specialist,,Office of Financial And Portfolio Management (OFPM),,OPIC Portfolio Monitoring,1,,Policy Clearance Completed,4fa2ef4e-4111-4445-8dd8-fd8fd49b255e,36030,,,,SOC-2846,0,9/16/2020,C-Cleared,Clearance Completed,,,,,EN-02846,0,C,9/16/2020,C-Cleared,2020-09-16,Clearance Completed,a21t000000Et7XS,9000104432-IQ Adjustment Initial Score 2021,,,,,EC-05604,a1It000000ASDfQ,Clearance Completed,2021-01-29,1/29/2021,C-Cleared,,124.7,126,Highly Developmental,0.1.4,,FPKDHWYWFQN4,0,0,8/3/2022,0,,1,,,,,9000104432,0,0,,4/23/2021,,,,0,,,,3/3/2021,,7/16/2020,,,4/23/2021,,,,IC,0,Middle,,India,India,Asia,0,0,0,1,,,386,,1,Lower Middle Income,1,0,,0,0,MOTILAL OSWAL HOME FINANCE LTD,,SF,,001t000000PrejI,,,India,,A-035214
MA - 000071,IndusInd-Waycool Foods and Products Private Limited,a273d000002Fwcl,,,,India,ODP,,0,0,0,0,0,,2023,,,2/28/2023,6/10/2025,Development Impact Monitoring Review,9000093562,,,0,0,,,,,,Office of Investment Policy,7/18/2024,,SMEF,,5500000,5500000,1,1,8/19/2019,,Transferred to Monitoring,100,Q4-2019,2019,164,1664,Portfolio,"Expansion of a food distribution company delivering staples, fruit and vegetables and dairy products.",0,0,3/8/2019,4/23/2025,,006t0000003C6zX,,"Director, Asset Management",,Office of Financial And Portfolio Management (OFPM),,OPIC Portfolio Monitoring,1,,Policy Clearance Completed,92527ba5-58ab-4c6e-8d6f-2649be9bb138,29244,,,,SOC-2589,0,8/9/2019,C-Cleared,Clearance Completed,,,,,EN-02589,0,B,7/2/2019,C-Cleared,2019-07-02,Clearance Completed,a213d000002ZtEt,9000093562-IQ Adjustment Initial Score 2019,,,,,EC-05343,a1It0000005Dced,Clearance Completed,2019-07-26,7/26/2019,C-Cleared,,67.5,133.95,Highly Developmental,0.1.4,,,0,0,10/8/2020,0,,1,,,,,9000093562,0,0,,,,,,0,,,,8/2/2019,,3/25/2019,,,8/2/2019,,,,Sub-IC,0,Low,,India,India,Asia,0,0,1,1,,,386,5500000,1,Lower Middle Income,0,1,,0,0,Soros Economic Development Fund,,SF,,001t0000001vbv3,,,USA,,A-018307
MA - 000070,IndusInd Bank - Kinara Capital Private Limited,a273d000002FwI3,,,,India,ODP,,0,0,0,0,0,,2023,,,2/27/2023,10/15/2025,Development Impact Monitoring Review,9000093393,,,0,0,,,,,,Office of Investment Policy,7/18/2024,,SMEF,,11000000,11000000,1,1,9/20/2019,,Transferred to Monitoring,100,Q4-2019,2019,276,1470,Portfolio,"Expansion of micro and small business loan portfolio serving 18,500 clients in southern India.",0,0,12/18/2018,4/14/2025,,006t00000037D2u,,"Managing Director, Financial Institutions Portfolio Management",,Office of Financial And Portfolio Management (OFPM),,OPIC Portfolio Monitoring,1,,Policy Clearance Completed,ed58863b-fe27-4209-b864-48377c3b4f67,27752,,,,SOC-2562,0,6/17/2019,C-Cleared,Clearance Completed,,,,,EN-02562,0,C,6/17/2019,C-Cleared,2019-06-17,Clearance Completed,a21t000000HGgvY,9000093393 Form_008_Submission_Adjustment 2021,,,,,EC-05310,a1It0000004pYWU,Clearance Completed,2019-06-28,6/28/2019,C-Cleared,,67.5,0,Not Scored,0.1.4,,,0,0,4/20/2021,0,,1,,,,,9000093393,0,0,,,,,,0,,,,8/27/2019,,12/18/2018,,,8/27/2019,,,,Sub-IC,0,Low,,India,India,Asia,0,0,1,1,,,386,11000000,1,,0,1,,0,0,Kinara Capital,,SF,,001t000000EcaR6,,,United States,,A-033845
MA - 000069,Cholamandalam Investment and Finance Co. Ltd.,a273d000002Fw89,,,,India,ODP,,0,0,0,0,0,,2023,,,3/2/2023,6/19/2028,Development Impact Monitoring Review,9000093498,,,0,0,,,,,,Office of Investment Policy,7/18/2024,,SF,,185000000,185000000,1,1,9/29/2019,,Transferred to Monitoring,100,Q4-2019,2019,230,1477,Portfolio,Vehicle finance onlending for SMEs throughout India targeting underbanked markets. Citi as US Nexus.,0,0,2/11/2019,4/29/2025,,006t0000003Apui,,Senior Investment Officer,,Office of Financial And Portfolio Management (OFPM),,OPIC Portfolio Monitoring,1,,Policy Clearance Completed,1f6f818e-9a35-4777-ae5d-09b0d3fa7284,29390,,,,SOC-2577,0,8/16/2019,C-Cleared,Clearance Completed,,,,,EN-02577,0,C,8/16/2019,C-Cleared,2019-08-16,Clearance Completed,a21t000000HGgv9,9000093498 Form_008_Submission_Adjustment 2021,,,,,EC-05331,a1It0000005EP10,Clearance Completed,2019-07-09,7/9/2019,C-Cleared,,67.5,0,Not Scored,0.1.4,,GMJYK3486VS4,0,0,4/13/2021,0,,1,,,,,9000093498,0,0,,8/12/2019,,,,0,9/11/2019,,,8/2/2019,,2/12/2019,,,9/11/2019,,,,Board,0,Low,,India,India,Asia,0,0,1,1,,,386,185000000,1,,0,1,,0,0,"Citibank, N.A.",,SF,,001t0000001uj9l,,,United States,,A-017643
MA - 000054,WBC - Akme Fintrade India Limited,a273d000001Uuk2,,,,India,ODP,,0,0,0,0,0,,2023,,,2/24/2023,12/20/2029,Development Impact Monitoring Review,9000093445,,,0,0,,,,,,,1/22/2024,,SMEF,,7800000,7800000,1,1,7/12/2019,,Transferred to Monitoring,100,Q4-2019,2019,183,1709,Portfolio,Project is the expansion of Akme's MSME loan portfolio,0,0,1/10/2019,4/16/2025,,006t0000002oMzK,,Portfolio Monitoring Specialist,,Office of Financial And Portfolio Management (OFPM),,OPIC Portfolio Monitoring,1,,Policy Clearance Completed,f325e39f-3ec2-46e1-9cce-12e8b014c17e,27753,,,,SOC-2555,0,4/29/2019,C-Cleared,Clearance Completed,,,,,EN-02555,0,C,4/15/2019,C-Cleared,2019-04-15,Clearance Completed,a21t000000HGgvT,9000093445 Form_008_Submission_Adjustment 2021,,,,,EC-05303,a1It0000004WmhU,Clearance Completed,2019-06-07,6/7/2019,C-Cleared,,82.5,0,Not Scored,0.1.4,,C15BM152HWW3,0,0,8/24/2020,0,,1,,,,,9000093445,0,0,,,,,,0,,,,7/16/2019,,,,,7/16/2019,,,,Sub-IC,0,Low,,India,India,Asia,0,0,1,1,,,386,7800000,1,,0,1,,0,0,"WorldBusiness Capital, Inc.",,SF,,001t000000C7bGy,,,United States,,A-033441
